{
  "adapter": {
    "argv": [
      "--model",
      "gpt-4o",
      "--topk",
      "3"
    ],
    "artifact_path": "safebench/scenario/scenario_data/scenic_data/dynamic_scenario/dynamic_0.scenic",
    "entrypoint": "retrieve/retrieve.py",
    "environment_passthrough": [
      "PATH",
      "LANG",
      "LC_ALL",
      "LD_LIBRARY_PATH",
      "CUDA_VISIBLE_DEVICES",
      "OPENAI_API_KEY",
      "OPENAI_BASE_URL",
      "HTTP_PROXY",
      "HTTPS_PROXY",
      "NO_PROXY"
    ],
    "failure_artifact_path": "safebench/scenario/scenario_data/scenic_data/dynamic_scenario/dynamic_0.txt",
    "max_artifact_bytes": 4194304,
    "max_stderr_bytes": 8388608,
    "max_stdout_bytes": 8388608,
    "python_environment_root": "/home/shijie20/CodeSpace/ChatScene/chatscene",
    "python_executable": "/home/shijie20/CodeSpace/ChatScene/chatscene/bin/python-frozen",
    "python_path_entries": [
      {
        "bytes": 29687376,
        "path": "/home/shijie20/CodeSpace/ChatScene/CARLA_0.9.13/PythonAPI/carla/dist/carla-0.9.13-py3.8-linux-x86_64.egg",
        "sha256": "cd0d3b399ec573eda96b21e2924d43f3dce8749f6126fba116c55c0ec9958e4e"
      }
    ],
    "query_file": "retrieve/scenario_descriptions.txt",
    "sandbox_executable": "/home/shijie20/.local/bin/bwrap",
    "snapshot_paths": [
      "Scenic/src",
      "retrieve",
      "safebench/util",
      "safebench/scenario/scenario_data/scenic_data/maps"
    ],
    "source_root": "/home/shijie20/CodeSpace/ChatScene",
    "timeout_seconds": 600,
    "type": "chatscene_legacy"
  },
  "finalization": {
    "ego_blueprint": "vehicle.chevrolet.impala",
    "ego_length_m": 5.33,
    "ego_width_m": 2.1,
    "policy_id": "carla_ego_proxy_v0.1"
  },
  "implementation_bundle": {
    "bundle_id": "chatscene-carla-implementation-v0.1",
    "bundle_sha256": "ecace7b371d6f13da5340e6b5b5607e16b438418f474c60426b0a823fdf3e4b2",
    "environment_manifest": {
      "bytes": 28252,
      "path": "/home/shijie20/CodeSpace/ChatScene/benchmark_configs/methods/chatscene_carla_environment_draft.json",
      "sha256": "d03f96ee580b0bb0e620599669b60f36c9eb3ae5444579b2d82558b6497c2216"
    },
    "files": [
      {
        "bytes": 68032,
        "path": "/home/shijie20/.local/bin/bwrap",
        "sha256": "af662c55cd85178a58da083220a9348c4a7d3c24333fd0bc7badb18c93392987"
      },
      {
        "bytes": 29687376,
        "path": "/home/shijie20/CodeSpace/ChatScene/CARLA_0.9.13/PythonAPI/carla/dist/carla-0.9.13-py3.8-linux-x86_64.egg",
        "sha256": "cd0d3b399ec573eda96b21e2924d43f3dce8749f6126fba116c55c0ec9958e4e"
      },
      {
        "bytes": 28252,
        "path": "/home/shijie20/CodeSpace/ChatScene/benchmark_configs/methods/benchmark_harness_environment_draft.json",
        "sha256": "d03f96ee580b0bb0e620599669b60f36c9eb3ae5444579b2d82558b6497c2216"
      },
      {
        "bytes": 28252,
        "path": "/home/shijie20/CodeSpace/ChatScene/benchmark_configs/methods/chatscene_carla_environment_draft.json",
        "sha256": "d03f96ee580b0bb0e620599669b60f36c9eb3ae5444579b2d82558b6497c2216"
      },
      {
        "bytes": 11396,
        "path": "/home/shijie20/CodeSpace/ChatScene/benchmark_configs/schemas/agent_query_review_draft.schema.json",
        "sha256": "4ceb0f46acfa89332cc659754208323fd44e0394d1d44ba3b12cf054f71556d2"
      },
      {
        "bytes": 3388,
        "path": "/home/shijie20/CodeSpace/ChatScene/benchmark_configs/schemas/agent_semantic_review_fragment.schema.json",
        "sha256": "e2582fd4c2df61ab895b033a145ee0fc0672ec23e467c715a0f5a6808631fa72"
      },
      {
        "bytes": 1040,
        "path": "/home/shijie20/CodeSpace/ChatScene/benchmark_configs/schemas/common_ontology.schema.json",
        "sha256": "4bbe5a7cd61dd252d7c0f33cd33bf24f44c014d3c99276a5d081ae308bd519a1"
      },
      {
        "bytes": 2075,
        "path": "/home/shijie20/CodeSpace/ChatScene/benchmark_configs/schemas/controller_config.schema.json",
        "sha256": "181054ea59f4418da037d2b58aebfacd2b080967fa6bd609806fd3af71f49d1a"
      },
      {
        "bytes": 8238,
        "path": "/home/shijie20/CodeSpace/ChatScene/benchmark_configs/schemas/cpd_aggregate.schema.json",
        "sha256": "ae03cec57d962d9a5b8f5bbeb35e788c1d5f6ee6dbec41482fa988312c166b7d"
      },
      {
        "bytes": 1769,
        "path": "/home/shijie20/CodeSpace/ChatScene/benchmark_configs/schemas/cpd_coverage.schema.json",
        "sha256": "0dae381302443646817e7ceffcbc252ef165ef17ca641833d174a9b923da73d6"
      },
      {
        "bytes": 3341,
        "path": "/home/shijie20/CodeSpace/ChatScene/benchmark_configs/schemas/cpd_input_record.schema.json",
        "sha256": "dc516619d4566f8dfee961dbeed847b2e78c881e80d950c614aae00d77c186fc"
      },
      {
        "bytes": 1893,
        "path": "/home/shijie20/CodeSpace/ChatScene/benchmark_configs/schemas/cross_platform_fixture_corpus.schema.json",
        "sha256": "153d359bd20cfb586d38815c6399078b22f9beae8173863b6b29158a88303fb4"
      },
      {
        "bytes": 1761,
        "path": "/home/shijie20/CodeSpace/ChatScene/benchmark_configs/schemas/freeze_asset.schema.json",
        "sha256": "71be65584782858d40608b10ce9f813c15415267e687ddeec9f509d104afdcd3"
      },
      {
        "bytes": 1501,
        "path": "/home/shijie20/CodeSpace/ChatScene/benchmark_configs/schemas/freeze_manifest.schema.json",
        "sha256": "6ac06698ee0d061b4bdfa706445a364e5fa7cdfec82fbb7d0cf9ce8fcf5a07e2"
      },
      {
        "bytes": 917,
        "path": "/home/shijie20/CodeSpace/ChatScene/benchmark_configs/schemas/freeze_protocol.schema.json",
        "sha256": "81f1ea5920b1ae36de8d7e2dc074377ae90427053a1e67282f529932d6d300f3"
      },
      {
        "bytes": 4175,
        "path": "/home/shijie20/CodeSpace/ChatScene/benchmark_configs/schemas/generation_evidence.schema.json",
        "sha256": "9844b4fcf2e3e99a415a577eb7375435f814d54de1c4b82d818198fa4b2024bf"
      },
      {
        "bytes": 2188,
        "path": "/home/shijie20/CodeSpace/ChatScene/benchmark_configs/schemas/generation_run_manifest.schema.json",
        "sha256": "ecc396fdd9a6ef50617024fa5fa5bbbf05721edb2ad2499c6738eb341ee2d928"
      },
      {
        "bytes": 3036,
        "path": "/home/shijie20/CodeSpace/ChatScene/benchmark_configs/schemas/human_bound_review_packet.schema.json",
        "sha256": "fdbf6a1ee39c6456752d69a48e4dff72827e136f50f4058e8f76a5d7398d2901"
      },
      {
        "bytes": 1545,
        "path": "/home/shijie20/CodeSpace/ChatScene/benchmark_configs/schemas/human_bound_review_submission.schema.json",
        "sha256": "d2e3eb824929b4bb091f2d037b4a1c509ff4b340f4ccaed44f894b8213bc411b"
      },
      {
        "bytes": 2105,
        "path": "/home/shijie20/CodeSpace/ChatScene/benchmark_configs/schemas/human_calibration_gold_record.schema.json",
        "sha256": "5ef21d382b5d4758f004528a2500ad88ae118e4b3fb25fb67e92c5e3ee31f500"
      },
      {
        "bytes": 1282,
        "path": "/home/shijie20/CodeSpace/ChatScene/benchmark_configs/schemas/human_carla_stage_calibration_report.schema.json",
        "sha256": "0131339e7898c2100ddb89587540dbc8ce5526a66fa6b510e1e931ef7c856e9c"
      },
      {
        "bytes": 2424,
        "path": "/home/shijie20/CodeSpace/ChatScene/benchmark_configs/schemas/human_carla_stage_calibration_roster.schema.json",
        "sha256": "ef7e01e14ad25a03c7d82ae9f392219c5e05366c808a1245893eeb5475f42c8c"
      },
      {
        "bytes": 1252,
        "path": "/home/shijie20/CodeSpace/ChatScene/benchmark_configs/schemas/human_carla_stage_platform_report.schema.json",
        "sha256": "fdaada12d950ed880448dbd6c20e26e7f31555160292a251e4cbee4ae64f9ad0"
      },
      {
        "bytes": 8494,
        "path": "/home/shijie20/CodeSpace/ChatScene/benchmark_configs/schemas/human_machine_draft_registry.schema.json",
        "sha256": "c2180cd9c62c6832a7f6a703cc2c86e1512a45095964abfcffe7ab253f316dcf"
      },
      {
        "bytes": 7250,
        "path": "/home/shijie20/CodeSpace/ChatScene/benchmark_configs/schemas/human_machine_draft_summary.schema.json",
        "sha256": "7f191392d3e155aaf5536079bb1736b0c28a179572026135a78f4f1120cd0e08"
      },
      {
        "bytes": 1705,
        "path": "/home/shijie20/CodeSpace/ChatScene/benchmark_configs/schemas/human_platform_gold_record.schema.json",
        "sha256": "a2059f07f04126389760cd959c299f4946867ca9c62137a73dac94d5be0167ca"
      },
      {
        "bytes": 2903,
        "path": "/home/shijie20/CodeSpace/ChatScene/benchmark_configs/schemas/human_post_test_private.schema.json",
        "sha256": "ddb59b12de13d446320868ad13a003ccc6500b57265f668c65c95f5779ce6ee3"
      },
      {
        "bytes": 2757,
        "path": "/home/shijie20/CodeSpace/ChatScene/benchmark_configs/schemas/human_post_test_public.schema.json",
        "sha256": "aa6123d71f47b8786db2865c5b60aa68cd15901510b18288058770f96886e52f"
      },
      {
        "bytes": 8519,
        "path": "/home/shijie20/CodeSpace/ChatScene/benchmark_configs/schemas/human_post_test_report.schema.json",
        "sha256": "a18ca4949f088fec777ddc505bab0877c929897e5235ef7ba3e9d0c75326bd04"
      },
      {
        "bytes": 1922,
        "path": "/home/shijie20/CodeSpace/ChatScene/benchmark_configs/schemas/human_post_test_submission.schema.json",
        "sha256": "44b1d9b23c6032ac317a2d89c3e11afa3a70884c2c862dad0db826e83a504b01"
      },
      {
        "bytes": 4789,
        "path": "/home/shijie20/CodeSpace/ChatScene/benchmark_configs/schemas/human_query_gold_record.schema.json",
        "sha256": "a49a7985221dfb60339a6d95ab39b6dcb6f64dd338bda8db91b4c96644cb9f7b"
      },
      {
        "bytes": 7800,
        "path": "/home/shijie20/CodeSpace/ChatScene/benchmark_configs/schemas/human_query_review_packet.schema.json",
        "sha256": "db8a60d5646ca9130e2e3501e873dbcbd05f771a156a1a97a4aa2b658e31a4f7"
      },
      {
        "bytes": 4208,
        "path": "/home/shijie20/CodeSpace/ChatScene/benchmark_configs/schemas/human_query_review_submission.schema.json",